{
  "$schema": "https://json-schema.org/draft/2020-12/schema",
  "$id": "https://schemas.jlaudio.local/jl-mixing/delivery-manifest.schema.json",
  "title": "JL Mixing Delivery Manifest",
  "type": "object",
  "required": [
    "metadata",
    "project",
    "client",
    "approved_revision",
    "delivery",
    "files"
  ],
  "properties": {
    "metadata": {
      "type": "object",
      "required": [
        "schema",
        "schema_version",
        "document_id",
        "created_by",
        "created_with",
        "created_at",
        "last_modified_at"
      ],
      "properties": {
        "schema": {
          "const": "mixing-delivery"
        },
        "schema_version": {
          "type": "string",
          "pattern": "^[0-9]+\\.[0-9]+\\.[0-9]+$"
        },
        "document_id": {
          "type": "string",
          "format": "uuid"
        },
        "created_by": {
          "type": "string",
          "minLength": 1
        },
        "created_with": {
          "type": "string",
          "pattern": "^jl-mixing [0-9]+\\.[0-9]+\\.[0-9]+$"
        },
        "created_at": {
          "type": "string",
          "format": "date-time"
        },
        "last_modified_at": {
          "type": "string",
          "format": "date-time"
        }
      },
      "additionalProperties": false
    },
    "project": {
      "type": "object",
      "required": [
        "project_document_id",
        "project_id",
        "project_name"
      ],
      "properties": {
        "project_document_id": {
          "type": "string",
          "format": "uuid"
        },
        "project_id": {
          "type": "string",
          "pattern": "^[a-z0-9]+(?:-[a-z0-9]+)*$"
        },
        "project_name": {
          "type": "string",
          "minLength": 1
        }
      },
      "additionalProperties": false
    },
    "client": {
      "type": "object",
      "required": [
        "client_document_id",
        "client_id"
      ],
      "properties": {
        "client_document_id": {
          "type": "string",
          "format": "uuid"
        },
        "client_id": {
          "type": "string",
          "pattern": "^[a-z0-9]+(?:-[a-z0-9]+)*$"
        }
      },
      "additionalProperties": false
    },
    "approved_revision": {
      "type": "integer",
      "minimum": 1
    },
    "delivery": {
      "type": "object",
      "required": [
        "method",
        "delivered_at",
        "delivered_by",
        "notes"
      ],
      "properties": {
        "method": {
          "type": "string",
          "minLength": 1
        },
        "delivered_at": {
          "type": [
            "string",
            "null"
          ],
          "format": "date-time"
        },
        "delivered_by": {
          "type": "string"
        },
        "notes": {
          "type": "string"
        }
      },
      "additionalProperties": false
    },
    "files": {
      "type": "array",
      "minItems": 1,
      "items": {
        "type": "object",
        "required": [
          "path",
          "deliverable_type"
        ],
        "properties": {
          "path": {
            "type": "string",
            "minLength": 1
          },
          "deliverable_type": {
            "type": "string",
            "enum": [
              "main_mix",
              "instrumental",
              "acapella",
              "tv_mix",
              "performance_mix",
              "stems",
              "master",
              "other"
            ]
          },
          "label": {
            "type": "string",
            "minLength": 1
          },
          "sample_rate": {
            "type": "integer",
            "minimum": 1
          },
          "bit_depth": {
            "type": "integer",
            "enum": [
              16,
              24,
              32
            ]
          },
          "file_format": {
            "type": "string"
          },
          "channels": {
            "type": "integer",
            "minimum": 1
          },
          "duration_seconds": {
            "type": "number",
            "minimum": 0
          },
          "file_size_bytes": {
            "type": "integer",
            "minimum": 0
          },
          "checksum": {
            "type": "object",
            "required": [
              "algorithm",
              "value"
            ],
            "properties": {
              "algorithm": {
                "const": "sha256"
              },
              "value": {
                "type": "string",
                "pattern": "^[a-fA-F0-9]{64}$"
              }
            },
            "additionalProperties": false
          }
        },
        "allOf": [
          {
            "if": {
              "properties": {
                "deliverable_type": {
                  "const": "other"
                }
              },
              "required": [
                "deliverable_type"
              ]
            },
            "then": {
              "required": [
                "label"
              ]
            }
          }
        ],
        "additionalProperties": false
      }
    }
  },
  "additionalProperties": false
}
